[
  {
    "id": "A:backup/MASTERDATA",
    "action": "backup",
    "type": "MASTERDATA",
    "row": 2,
    "docUrl": "https://www.eplan.help/en-us/Infoportal/Content/api/2026/backup.html",
    "category": "项目管理",
    "milestone": "M3",
    "milestoneOptional": true,
    "context": ["master_data", "file"],
    "effect": ["writes_files"],
    "effectInferred": false,
    "parameters": [
      {"name": "MDTYPE"},
      {"name": "SOURCEPATH"},
      {"name": "FILENAME"},
      {"name": "DESTINATIONPATH"},
      {"name": "ARCHIVENAME"},
      {"name": "COMMENT", "required": false}
    ],
    "status": "registered",
    "plannedHandling": "低优先级：主数据是公司/工作站级资源",
    "notes": "备份主数据文件（符号、宏、表格等）。"
  },
  {
    "id": "A:backup/PROJECT",
    "action": "backup",
    "type": "PROJECT",
    "row": 1,
    "docUrl": "https://www.eplan.help/en-us/Infoportal/Content/api/2026/backup.html",
    "category": "项目管理",
    "milestone": "M2-M3",
    "context": ["project", "file"],
    "effect": ["writes_files", "writes_project"],
    "effectInferred": false,
    "parameters": [
      {"name": "PROJECTNAME", "required": false},
      {"name": "ARCHIVENAME"},
      {"name": "DESTINATIONPATH"},
      {"name": "COMMENT", "required": false},
      {"name": "AUTOCOPYREFDATA", "required": false},
      {"name": "INCLEXTDOCS", "required": false},
      {"name": "INCLIMAGES", "required": false},
      {"name": "BACKUPMETHOD"}
    ],
    "status": "registered",
    "plannedHandling": "eplan_project_backup，同时用作 Destructive 操作前的保护步骤。初期只允许 BACKUPMETHOD:BACKUP：文档没有说明 SOURCEOUT（filed off）和 ARCHIVE 对原项目有什么影响",
    "notes": "把整个项目备份到归档文件。BACKUPMETHOD 取 SOURCEOUT 或 ARCHIVE 时对原项目的影响文档没有说明（7.2 第 3 条），初期只用 BACKUP。"
  },
  {
    "id": "A:changelayer",
    "action": "changelayer",
    "type": null,
    "row": 3,
    "docUrl": "https://www.eplan.help/en-us/Infoportal/Content/api/2026/changelayer.html",
    "category": "受控白名单",
    "milestone": "M4",
    "context": ["project"],
    "effect": ["writes_project"],
    "effectInferred": false,
    "parameters": [
      {"name": "PROJECTNAME", "required": false},
      {"name": "LAYER[n]"},
      {"name": "VISIBLE[n]", "required": false},
      {"name": "PRINTED[n]", "required": false},
      {"name": "TEXTHEIGHT[n]", "required": false},
      {"name": "COLORID[n]", "required": false},
      {"name": "TRANSPARENCY[n]", "required": false}
    ],
    "status": "registered",
    "plannedHandling": "放入 eplan_action_run，不单独做工具",
    "notes": "修改图层属性（可见、打印、字高、颜色、3D 透明度）。"
  },
  {
    "id": "A:check/INSTALLATIONSPACE",
    "action": "check",
    "type": "INSTALLATIONSPACE",
    "row": 8,
    "docUrl": "https://www.eplan.help/en-us/Infoportal/Content/api/2026/check.html",
    "category": "3D/生产",
    "milestone": "M4b",
    "context": ["project"],
    "effect": ["writes_project"],
    "effectInferred": true,
    "parameters": [
      {"name": "PROJECTNAME", "required": false},
      {"name": "INSTALLATIONSPACENAME"},
      {"name": "INSTALLATIONSPACENAMEn"},
      {"name": "STRUCTURE"},
      {"name": "STRUCTUREn"}
    ],
    "status": "registered",
    "plannedHandling": "Pro Panel 工具家族中的检查",
    "notes": "检查安装空间（3D）。推断：检查消息会写进项目的消息管理，不改设计数据；这一点尚未验证（api-actions 7.2 第 1 条），在真实项目上运行前必须先验证。"
  },
  {
    "id": "A:check/ONLYCOMPLETED",
    "action": "check",
    "type": "ONLYCOMPLETED",
    "row": 6,
    "docUrl": "https://www.eplan.help/en-us/Infoportal/Content/api/2026/check.html",
    "category": "检查与消息",
    "milestone": "M2",
    "context": ["project"],
    "effect": ["writes_project"],
    "effectInferred": true,
    "parameters": [
      {"name": "PROJECTNAME", "required": false},
      {"name": "VERIFICATIONSCHEME", "required": false}
    ],
    "status": "registered",
    "plannedHandling": "eplan_check_run 的一个选项",
    "notes": "检查项目，只看已完成的消息。推断：检查消息会写进项目的消息管理，不改设计数据；这一点尚未验证（api-actions 7.2 第 1 条），在真实项目上运行前必须先验证。"
  },
  {
    "id": "A:check/PAGES",
    "action": "check",
    "type": "PAGES",
    "row": 5,
    "docUrl": "https://www.eplan.help/en-us/Infoportal/Content/api/2026/check.html",
    "category": "检查与消息",
    "milestone": "M2",
    "context": ["project", "page"],
    "effect": ["writes_project"],
    "effectInferred": true,
    "parameters": [
      {"name": "PROJECTNAME", "required": false},
      {"name": "VERIFICATIONSCHEME", "required": false},
      {"name": "PAGENAME", "required": false},
      {"name": "SELn", "required": false},
      {"name": "USEPAGEFILTER", "required": false}
    ],
    "status": "registered",
    "plannedHandling": "eplan_check_run",
    "notes": "检查页面。推断：检查消息会写进项目的消息管理，不改设计数据；这一点尚未验证（api-actions 7.2 第 1 条），在真实项目上运行前必须先验证。官方对 SELn 的说明写成只对 PAGE 值有效，而 TYPE 值是 PAGES（7.4）。"
  },
  {
    "id": "A:check/PARTS",
    "action": "check",
    "type": "PARTS",
    "row": 7,
    "docUrl": "https://www.eplan.help/en-us/Infoportal/Content/api/2026/check.html",
    "category": "检查与消息",
    "milestone": "M2",
    "milestoneOptional": true,
    "context": ["master_data"],
    "effect": ["unknown"],
    "effectInferred": true,
    "parameters": [
      {"name": "VERIFICATIONSCHEME", "required": false},
      {"name": "VERIFYCOMPLETEDONLY"},
      {"name": "PARTNUMBERn", "required": false},
      {"name": "PARTVARIANTn", "required": false}
    ],
    "status": "registered",
    "plannedHandling": "eplan_check_run 的可选范围；也可以并入部件工具",
    "notes": "检查部件（不需要 PROJECTNAME）。消息写到哪里文档没有说明，效果记为 unknown。"
  },
  {
    "id": "A:check/PROJECT",
    "action": "check",
    "type": "PROJECT",
    "row": 4,
    "docUrl": "https://www.eplan.help/en-us/Infoportal/Content/api/2026/check.html",
    "category": "检查与消息",
    "milestone": "M2",
    "context": ["project"],
    "effect": ["writes_project"],
    "effectInferred": true,
    "parameters": [
      {"name": "PROJECTNAME", "required": false},
      {"name": "VERIFICATIONSCHEME", "required": false},
      {"name": "VERIFYCOMPLETEDONLY"},
      {"name": "USEPAGEFILTER", "required": false}
    ],
    "status": "registered",
    "plannedHandling": "eplan_check_run；结果用 PrjMessagesCollection 读取（见第 5 节）",
    "notes": "检查项目。推断：检查消息会写进项目的消息管理，不改设计数据；这一点尚未验证（api-actions 7.2 第 1 条），在真实项目上运行前必须先验证。"
  },
  {
    "id": "A:CleanWorkspaceAction",
    "action": "CleanWorkspaceAction",
    "type": null,
    "row": 9,
    "docUrl": "https://www.eplan.help/en-us/Infoportal/Content/api/2026/CleanWorkspaceAction.html",
    "category": "不覆盖",
    "milestone": "none",
    "context": ["system_settings", "gui"],
    "effect": ["gui_only", "writes_settings"],
    "effectInferred": false,
    "parameters": [
      {"name": "Workspacename"},
      {"name": "Silent"}
    ],
    "status": "excluded",
    "reason": "interactive_ui",
    "plannedHandling": "工作区是界面布局，与项目数据无关",
    "notes": "清理工作区。需要主窗口（7.5）。"
  },
  {
    "id": "A:compress",
    "action": "compress",
    "type": null,
    "row": 10,
    "docUrl": "https://www.eplan.help/en-us/Infoportal/Content/api/2026/compress.html",
    "category": "项目管理",
    "milestone": "M3",
    "context": ["project"],
    "effect": ["writes_project"],
    "effectInferred": false,
    "parameters": [
      {"name": "PROJECTNAME", "required": false},
      {"name": "CONFIGSCHEME", "required": false}
    ],
    "status": "registered",
    "plannedHandling": "eplan_project_compress，Destructive，执行前先备份",
    "notes": "按配置方案压缩项目。压缩会删除或改动哪些内容由配置方案决定，文档没有说明（7.2 第 4 条）。"
  },
  {
    "id": "A:devicelist/DELETE",
    "action": "devicelist",
    "type": "DELETE",
    "row": 13,
    "docUrl": "https://www.eplan.help/en-us/Infoportal/Content/api/2026/devicelist.html",
    "category": "导入",
    "milestone": "M4",
    "context": ["project"],
    "effect": ["writes_project"],
    "effectInferred": false,
    "parameters": [
      {"name": "PROJECTNAME", "required": false}
    ],
    "status": "registered",
    "plannedHandling": "并入设备清单导入工具，Destructive",
    "notes": "删除设备清单。删除项目中的设备清单数据。"
  },
  {
    "id": "A:devicelist/EXPORT",
    "action": "devicelist",
    "type": "EXPORT",
    "row": 12,
    "docUrl": "https://www.eplan.help/en-us/Infoportal/Content/api/2026/devicelist.html",
    "category": "导出",
    "milestone": "M4",
    "context": ["project", "file"],
    "effect": ["writes_files"],
    "effectInferred": false,
    "parameters": [
      {"name": "PROJECTNAME", "required": false},
      {"name": "EXPORTFILE"},
      {"name": "FORMAT", "required": false}
    ],
    "status": "registered",
    "plannedHandling": "eplan_export_*（设备清单）",
    "notes": "导出设备清单。"
  },
  {
    "id": "A:devicelist/IMPORT",
    "action": "devicelist",
    "type": "IMPORT",
    "row": 11,
    "docUrl": "https://www.eplan.help/en-us/Infoportal/Content/api/2026/devicelist.html",
    "category": "导入",
    "milestone": "M4",
    "context": ["project", "file"],
    "effect": ["writes_project"],
    "effectInferred": false,
    "parameters": [
      {"name": "PROJECTNAME", "required": false},
      {"name": "IMPORTFILE"},
      {"name": "FORMAT", "required": false}
    ],
    "status": "registered",
    "plannedHandling": "任务型导入工具，Destructive",
    "notes": "导入设备清单。"
  },
  {
    "id": "A:edit",
    "action": "edit",
    "type": null,
    "row": 14,
    "docUrl": "https://www.eplan.help/en-us/Infoportal/Content/api/2026/edit.html",
    "category": "项目管理",
    "milestone": "M2-M3",
    "context": ["project", "page", "gui"],
    "effect": ["gui_only"],
    "effectInferred": false,
    "parameters": [
      {"name": "PROJECTNAME", "required": false},
      {"name": "PAGENAME", "required": false},
      {"name": "DEVICENAME", "required": false},
      {"name": "X", "required": false},
      {"name": "Y", "required": false},
      {"name": "INSTALLATIONSPACE", "required": false},
      {"name": "DEVICENAME3D", "required": false},
      {"name": "IGNOREWHENOPEN", "required": false}
    ],
    "status": "registered",
    "plannedHandling": "“打开项目”并入 eplan_project_open（更适合用 ProjectOpen）；“在界面中定位到某页或某设备”可以做成可选的展示工具",
    "notes": "在界面中打开项目、页面、设备所在页或布局空间，可以定位到坐标。只定位或打开，不改数据。"
  },
  {